{
  "schema": "growth-calendar/1",
  "id": "makeyourmindup-v1",
  "status": "proposed",
  "note": "The V1 posting calendar: one wave per piece, weekly rows, floors and caps. Every row's lane is derived from invariants/authority.json; growth.py run calendar lint resolves a steady-state week (caps, priority, then each row's requires) and proves the floors and caps hold. Rows a cap cuts are reported as bumped, not hidden.",
  "tz": "America/New_York",
  "authority": "invariants/authority.json",
  "kit": "social/brand/kit.json",
  "preview_until": "2026-11-29",
  "pieces": [
    {"series": "follow.the.money", "weekday": "MO"},
    {"series": "under.the.hood", "weekday": "WE"},
    {"series": "mind.the.gap", "weekday": "FR"}
  ],
  "templates": {
    "note-image": "note-image",
    "receipt-card-x": "x-card",
    "receipt-card-threads": "portrait",
    "scorecard-note": "note-image",
    "scorecard-threads": "portrait",
    "poll-result-x": "x-card",
    "poll-result-threads": "portrait",
    "poll-result-note": "note-image",
    "story-hook": "story",
    "story-proof": "story",
    "story-action": "story",
    "meme-square": "square",
    "meme-video": "story"
  },
  "wave": [
    {"id": "note-quote", "days": [0, 0], "at": "publish+1h", "channel": "substack-notes", "format": "note", "class": "note-quote", "template": "note-image", "producer": "canva-lane", "lane": "L0_code", "priority": 1, "requires": null, "link": "none"},
    {"id": "receipt-x", "days": [0, 0], "at": "publish+2h", "channel": "x", "format": "receipt-card", "class": "receipt-card", "template": "receipt-card-x", "producer": "canva-lane", "lane": "L0_code", "priority": 1, "requires": null, "link": "reply"},
    {"id": "receipt-threads", "days": [0, 0], "at": "publish+2h", "channel": "threads", "format": "receipt-card", "class": "receipt-card", "template": "receipt-card-threads", "producer": "canva-lane", "lane": "L0_code", "priority": 1, "requires": null, "link": "reply"},
    {"id": "carousel-instagram", "days": [0, 0], "at": "publish+3h", "channel": "instagram", "format": "carousel", "class": "carousel", "template": null, "producer": "content-engine", "lane": "L2_eyes", "priority": 1, "requires": null, "link": "none"},
    {"id": "carousel-facebook", "days": [0, 0], "at": "publish+3h", "channel": "facebook", "format": "carousel", "class": "carousel", "template": null, "producer": "content-engine", "lane": "L2_eyes", "priority": 1, "requires": null, "link": "none"},
    {"id": "short-youtube", "days": [0, 0], "at": "publish+4h", "channel": "youtube", "format": "short-video", "class": "video-cut", "template": null, "producer": "content-engine", "lane": "L0_code", "priority": 1, "requires": null, "link": "none"},
    {"id": "short-tiktok", "days": [0, 0], "at": "publish+4h", "channel": "tiktok", "format": "short-video", "class": "video-cut", "template": null, "producer": "content-engine", "lane": "L0_code", "priority": 1, "requires": null, "link": "none"},
    {"id": "story-hook-instagram", "days": [0, 1], "at": "publish+5h", "channel": "instagram", "format": "story-frame", "class": "story-from-assets", "template": "story-hook", "producer": "canva-lane", "lane": "L0_code", "priority": 1, "requires": null, "link": "none"},
    {"id": "story-proof-instagram", "days": [0, 1], "at": "publish+5h", "channel": "instagram", "format": "story-frame", "class": "story-from-assets", "template": "story-proof", "producer": "canva-lane", "lane": "L0_code", "priority": 1, "requires": null, "link": "none"},
    {"id": "story-action-instagram", "days": [0, 1], "at": "publish+5h", "channel": "instagram", "format": "story-frame", "class": "story-from-assets", "template": "story-action", "producer": "canva-lane", "lane": "L0_code", "priority": 1, "requires": null, "link": "none"},
    {"id": "story-hook-facebook", "days": [0, 1], "at": "publish+5h", "channel": "facebook", "format": "story-frame", "class": "story-from-assets", "template": "story-hook", "producer": "canva-lane", "lane": "L0_code", "priority": 1, "requires": null, "link": "none"},
    {"id": "story-proof-facebook", "days": [0, 1], "at": "publish+5h", "channel": "facebook", "format": "story-frame", "class": "story-from-assets", "template": "story-proof", "producer": "canva-lane", "lane": "L0_code", "priority": 1, "requires": null, "link": "none"},
    {"id": "story-action-facebook", "days": [0, 1], "at": "publish+5h", "channel": "facebook", "format": "story-frame", "class": "story-from-assets", "template": "story-action", "producer": "canva-lane", "lane": "L0_code", "priority": 1, "requires": null, "link": "none"},
    {"id": "scorecard-notes", "days": [1, 1], "at": "08:00", "channel": "substack-notes", "format": "note", "class": "scorecard", "template": "scorecard-note", "producer": "canva-lane", "lane": "L2_eyes", "priority": 2, "requires": null, "link": "none"},
    {"id": "scorecard-threads", "days": [1, 1], "at": "12:00", "channel": "threads", "format": "scorecard", "class": "scorecard", "template": "scorecard-threads", "producer": "canva-lane", "lane": "L2_eyes", "priority": 2, "requires": null, "link": "last"},
    {"id": "poll-x", "days": [2, 2], "at": "09:00", "channel": "x", "format": "poll", "class": "poll", "template": null, "producer": "words", "lane": "L2_eyes", "priority": 3, "requires": null, "link": "reply"},
    {"id": "poll-threads", "days": [2, 2], "at": "12:00", "channel": "threads", "format": "poll", "class": "poll", "template": null, "producer": "words", "lane": "L2_eyes", "priority": 3, "requires": null, "link": "last"},
    {"id": "poll-notes", "days": [2, 2], "at": "08:00", "channel": "substack-notes", "format": "note", "class": "poll", "template": null, "producer": "words", "lane": "L2_eyes", "priority": 3, "requires": null, "link": "none"},
    {"id": "poll-result-x", "days": [3, 3], "at": "09:00", "channel": "x", "format": "poll", "class": "poll", "template": "poll-result-x", "producer": "canva-lane", "lane": "L2_eyes", "priority": 4, "requires": "poll-x", "link": "reply"},
    {"id": "poll-result-threads", "days": [3, 3], "at": "12:00", "channel": "threads", "format": "poll", "class": "poll", "template": "poll-result-threads", "producer": "canva-lane", "lane": "L2_eyes", "priority": 4, "requires": "poll-threads", "link": "last"},
    {"id": "poll-result-notes", "days": [3, 3], "at": "17:00", "channel": "substack-notes", "format": "note", "class": "poll", "template": "poll-result-note", "producer": "canva-lane", "lane": "L2_eyes", "priority": 4, "requires": "poll-notes", "link": "none"},
    {"id": "restack-notes", "days": [4, 4], "at": "12:00", "channel": "substack-notes", "format": "note", "class": "article-reshare", "template": null, "producer": "words", "lane": "L0_code", "priority": 8, "requires": null, "link": "none"},
    {"id": "recut-notes-am", "days": [3, 6], "at": "08:00", "channel": "substack-notes", "format": "note", "class": "note-quote", "template": null, "producer": "words", "lane": "L0_code", "priority": 9, "requires": null, "link": "none"},
    {"id": "recut-notes-pm", "days": [3, 6], "at": "17:00", "channel": "substack-notes", "format": "note", "class": "note-quote", "template": null, "producer": "words", "lane": "L0_code", "priority": 9, "requires": null, "link": "none"},
    {"id": "recut-threads", "days": [3, 6], "at": "12:00", "channel": "threads", "format": "text", "class": "post-quote", "template": null, "producer": "words", "lane": "L0_code", "priority": 9, "requires": null, "link": "last"},
    {"id": "recut-x", "days": [3, 6], "at": "09:00", "channel": "x", "format": "text", "class": "post-quote", "template": null, "producer": "words", "lane": "L0_code", "priority": 9, "requires": null, "link": "reply"}
  ],
  "weekly": [
    {"id": "meme-instagram-tu", "weekday": "TU", "at": "11:00", "channel": "instagram", "format": "meme", "class": "meme", "template": "meme-square", "producer": "canva-lane", "lane": "L2_eyes", "priority": 5, "requires": null, "link": "none"},
    {"id": "meme-instagram-th", "weekday": "TH", "at": "11:00", "channel": "instagram", "format": "meme", "class": "meme", "template": "meme-square", "producer": "canva-lane", "lane": "L2_eyes", "priority": 5, "requires": null, "link": "none"},
    {"id": "meme-instagram-sa", "weekday": "SA", "at": "11:00", "channel": "instagram", "format": "meme", "class": "meme", "template": "meme-square", "producer": "canva-lane", "lane": "L2_eyes", "priority": 5, "requires": null, "link": "none"},
    {"id": "meme-tiktok-tu", "weekday": "TU", "at": "18:00", "channel": "tiktok", "format": "meme", "class": "meme", "template": "meme-video", "producer": "canva-lane", "lane": "L2_eyes", "priority": 5, "requires": null, "link": "none"},
    {"id": "meme-tiktok-th", "weekday": "TH", "at": "18:00", "channel": "tiktok", "format": "meme", "class": "meme", "template": "meme-video", "producer": "canva-lane", "lane": "L2_eyes", "priority": 5, "requires": null, "link": "none"},
    {"id": "meme-tiktok-sa", "weekday": "SA", "at": "18:00", "channel": "tiktok", "format": "meme", "class": "meme", "template": "meme-video", "producer": "canva-lane", "lane": "L2_eyes", "priority": 5, "requires": null, "link": "none"},
    {"id": "meme-youtube-tu", "weekday": "TU", "at": "18:00", "channel": "youtube", "format": "meme", "class": "meme", "template": "meme-video", "producer": "canva-lane", "lane": "L2_eyes", "priority": 5, "requires": null, "link": "none"},
    {"id": "meme-youtube-th", "weekday": "TH", "at": "18:00", "channel": "youtube", "format": "meme", "class": "meme", "template": "meme-video", "producer": "canva-lane", "lane": "L2_eyes", "priority": 5, "requires": null, "link": "none"},
    {"id": "meme-youtube-sa", "weekday": "SA", "at": "18:00", "channel": "youtube", "format": "meme", "class": "meme", "template": "meme-video", "producer": "canva-lane", "lane": "L2_eyes", "priority": 5, "requires": null, "link": "none"},